{
  "schemaVersion": 1,
  "id": "graph-demo",
  "revision": 1,
  "sessionID": "session-demo",
  "nodes": [
    {
      "id": "question-root",
      "kind": "question",
      "text": "Welche Betriebsform passt zu meinem Testprojekt?",
      "origin": "user",
      "curationState": "curated",
      "evidenceIDs": [],
      "sourceStatus": "notApplicable",
      "revision": 1
    },
    {
      "id": "session-root",
      "kind": "session",
      "text": "Testsession zur Architekturentscheidung",
      "origin": "system",
      "curationState": "curated",
      "evidenceIDs": [],
      "sourceStatus": "notApplicable",
      "revision": 1
    },
    {
      "id": "claim-1",
      "kind": "claim",
      "text": "Ein lokales Modell kann Anfragen ohne externen Modellanbieter verarbeiten.",
      "origin": "source",
      "curationState": "curated",
      "evidenceIDs": [
        "ev-1-0"
      ],
      "sourceStatus": "available",
      "revision": 1
    },
    {
      "id": "evidence-node-1",
      "kind": "evidence",
      "text": "Lokaler Betrieb — Testfolge",
      "origin": "source",
      "curationState": "curated",
      "evidenceIDs": [
        "ev-1-0"
      ],
      "sourceStatus": "available",
      "revision": 1
    },
    {
      "id": "claim-2",
      "kind": "claim",
      "text": "Ein verwalteter Cloud-Dienst kann den eigenen Betriebsaufwand fuer ein Modell verringern.",
      "origin": "source",
      "curationState": "curated",
      "evidenceIDs": [
        "ev-2-0"
      ],
      "sourceStatus": "available",
      "revision": 1
    },
    {
      "id": "evidence-node-2",
      "kind": "evidence",
      "text": "Verwaltete Dienste — Testfolge",
      "origin": "source",
      "curationState": "curated",
      "evidenceIDs": [
        "ev-2-0"
      ],
      "sourceStatus": "available",
      "revision": 1
    },
    {
      "id": "claim-3",
      "kind": "claim",
      "text": "Fuer Arbeiten ohne Netz braucht eine Anwendung einen verlaesslichen lokalen Pfad.",
      "origin": "source",
      "curationState": "curated",
      "evidenceIDs": [
        "ev-3-0"
      ],
      "sourceStatus": "available",
      "revision": 1
    },
    {
      "id": "evidence-node-3",
      "kind": "evidence",
      "text": "Offline-Anforderungen — Testfolge",
      "origin": "source",
      "curationState": "curated",
      "evidenceIDs": [
        "ev-3-0"
      ],
      "sourceStatus": "available",
      "revision": 1
    },
    {
      "id": "claim-4",
      "kind": "claim",
      "text": "Eine hybride Architektur kann lokale Grundfunktionen und verwaltete Zusatzfunktionen trennen.",
      "origin": "source",
      "curationState": "curated",
      "evidenceIDs": [
        "ev-4-0"
      ],
      "sourceStatus": "available",
      "revision": 1
    },
    {
      "id": "evidence-node-4",
      "kind": "evidence",
      "text": "Hybride Systeme — Testfolge",
      "origin": "source",
      "curationState": "curated",
      "evidenceIDs": [
        "ev-4-0"
      ],
      "sourceStatus": "available",
      "revision": 1
    }
  ],
  "edges": [
    {
      "id": "edge-session",
      "fromID": "session-root",
      "toID": "question-root",
      "relation": "asks",
      "origin": "system",
      "reviewStatus": "systemVerified",
      "evidenceIDs": []
    },
    {
      "id": "edge-proof-1",
      "fromID": "claim-1",
      "toID": "evidence-node-1",
      "relation": "supportedBy",
      "origin": "system",
      "reviewStatus": "systemVerified",
      "evidenceIDs": [
        "ev-1-0"
      ]
    },
    {
      "id": "edge-question-1",
      "fromID": "claim-1",
      "toID": "question-root",
      "relation": "about",
      "origin": "model",
      "reviewStatus": "proposed",
      "evidenceIDs": [
        "ev-1-0"
      ]
    },
    {
      "id": "edge-proof-2",
      "fromID": "claim-2",
      "toID": "evidence-node-2",
      "relation": "supportedBy",
      "origin": "system",
      "reviewStatus": "systemVerified",
      "evidenceIDs": [
        "ev-2-0"
      ]
    },
    {
      "id": "edge-question-2",
      "fromID": "claim-2",
      "toID": "question-root",
      "relation": "about",
      "origin": "model",
      "reviewStatus": "proposed",
      "evidenceIDs": [
        "ev-2-0"
      ]
    },
    {
      "id": "edge-proof-3",
      "fromID": "claim-3",
      "toID": "evidence-node-3",
      "relation": "supportedBy",
      "origin": "system",
      "reviewStatus": "systemVerified",
      "evidenceIDs": [
        "ev-3-0"
      ]
    },
    {
      "id": "edge-question-3",
      "fromID": "claim-3",
      "toID": "question-root",
      "relation": "about",
      "origin": "model",
      "reviewStatus": "proposed",
      "evidenceIDs": [
        "ev-3-0"
      ]
    },
    {
      "id": "edge-proof-4",
      "fromID": "claim-4",
      "toID": "evidence-node-4",
      "relation": "supportedBy",
      "origin": "system",
      "reviewStatus": "systemVerified",
      "evidenceIDs": [
        "ev-4-0"
      ]
    },
    {
      "id": "edge-question-4",
      "fromID": "claim-4",
      "toID": "question-root",
      "relation": "about",
      "origin": "model",
      "reviewStatus": "proposed",
      "evidenceIDs": [
        "ev-4-0"
      ]
    },
    {
      "id": "edge-alternative",
      "fromID": "claim-2",
      "toID": "claim-1",
      "relation": "qualifies",
      "origin": "model",
      "reviewStatus": "proposed",
      "evidenceIDs": [
        "ev-1-0",
        "ev-2-0",
        "ev-2-1",
        "ev-2-2"
      ]
    }
  ],
  "scopeEpisodeIDs": [
    "episode-1",
    "episode-2",
    "episode-3",
    "episode-4"
  ],
  "exportState": "preview",
  "includesPrivateNotes": false
}
